cog_category,cog_description,n_shifters_in_cat,n_nonshifters_in_cat,n_shifters_total,n_nonshifters_total,odds_ratio,pvalue,fdr_qvalue
E,Amino acid transport and metabolism,167,171,1593,2292,1.452584828129229,0.0011716268134968604,0.026947416710427788
V,Defense mechanisms,23,64,1593,2292,0.5099920382165605,0.005584350041858154,0.06422002548136878
I,Lipid transport and metabolism,29,66,1593,2292,0.6253778191118344,0.04423136029020231,0.2668481042699269
S,Function unknown,577,766,1593,2292,1.1313783639316626,0.07454251708945256,0.2668481042699269
G,Carbohydrate transport and metabolism,128,223,1593,2292,0.8106398934786269,0.07766299560148898,0.2668481042699269
N,Cell motility,45,44,1593,2292,1.485200845665962,0.08050635017329208,0.2668481042699269
H,Coenzyme transport and metabolism,68,73,1593,2292,1.3554188187738603,0.08121464042997775,0.2668481042699269
O,"Post-translational modification, protein turnover, chaperones",47,92,1593,2292,0.7269812700376849,0.09486809445659947,0.27274577156272345
C,Energy production and conversion,94,165,1593,2292,0.8083692158408636,0.11673205469207174,0.2971219118504072
U,"Intracellular trafficking, secretion, and vesicular transport",14,33,1593,2292,0.6069434049168058,0.13588599163267484,0.2971219118504072
K,Transcription,113,135,1593,2292,1.2199249249249249,0.14210178392845563,0.2971219118504072
X,"Mobilome: prophages, transposons",12,10,1593,2292,1.732068311195446,0.20048788780623633,0.3839620323490947
P,Inorganic ion transport and metabolism,76,131,1593,2292,0.8264402924615175,0.21702201828427092,0.3839620323490947
Q,"Secondary metabolites biosynthesis, transport and catabolism",13,28,1593,2292,0.6652802893309222,0.26493440267935675,0.4352493758303718
F,Nucleotide transport and metabolism,28,50,1593,2292,0.8022492012779553,0.41586278941576227,0.6376562771041688
T,Signal transduction mechanisms,56,92,1593,2292,0.8712624819665639,0.4442182211580123,0.6385636929146427
L,"Replication, recombination and repair",46,75,1593,2292,0.8789657401422107,0.5127040536354015,0.6936584255067197
R,General function prediction only,78,123,1593,2292,0.9078966433228689,0.5559879840196418,0.6997616907444949
W,Extracellular structures,14,16,1593,2292,1.2612412919569347,0.5780640053976263,0.6997616907444949
D,"Cell cycle control, cell division, chromosome partitioning",6,12,1593,2292,0.718336483931947,0.6337031321699631,0.7287586019954576
M,Cell wall/membrane/envelope biogenesis,66,91,1593,2292,1.0454025345970337,0.8040760367512483,0.8806547069180338
J,"Translation, ribosomal structure and biogenesis",45,64,1593,2292,1.0119912790697674,1.0,1.0
A,RNA processing and modification,0,1,1593,2292,0.0,1.0,1.0
